"conversation_id_str","created_at","favorite_count","full_text","id_str","image_url","in_reply_to_screen_name","lang","location","quote_count","reply_count","retweet_count","tweet_url","user_id_str","username"
"1799831163756015740","Mon Jun 10 04:30:06 +0000 2024","0","@id_fm Tim bea cukai ga ada neh? Padahal gede duitnya","1800022604612604048","","id_fm","in","","0","0","0","https://x.com/Faizaljam/status/1800022604612604048","52684654","Faizaljam"
"1800022394737942782","Mon Jun 10 04:29:41 +0000 2024","0","Selengkapnya klik tautan https://t.co/rU4bnFs8tj","1800022501822701900","","beacukaimalang","in","Jl. Surabaya No.2 Malang 65145","0","0","0","https://x.com/beacukaimalang/status/1800022501822701900","2473262706","beacukaimalang"
"1800022394737942782","Mon Jun 10 04:29:16 +0000 2024","1","Bea Cukai Malang Gelar Apel Rutin Bulan Juni https://t.co/nD9OWqRxIf","1800022394737942782","https://pbs.twimg.com/media/GPr20PQa4AAED3O.jpg","","in","Jl. Surabaya No.2 Malang 65145","0","1","0","https://x.com/beacukaimalang/status/1800022394737942782","2473262706","beacukaimalang"
"1800022126982058099","Mon Jun 10 04:28:25 +0000 2024","0","Selengkapnya klik tautan https://t.co/pebIbHkZKn","1800022180706849235","","beacukaimalang","in","Jl. Surabaya No.2 Malang 65145","0","0","0","https://x.com/beacukaimalang/status/1800022180706849235","2473262706","beacukaimalang"
"1800022126982058099","Mon Jun 10 04:28:12 +0000 2024","1","Bea Cukai Malang Edukasi Gempur Rokok Ilegal Kepada Komunitas Sound System https://t.co/cZCWvj98ST","1800022126982058099","https://pbs.twimg.com/media/GPr2lF7bQAAgjKw.jpg","","in","Jl. Surabaya No.2 Malang 65145","0","1","0","https://x.com/beacukaimalang/status/1800022126982058099","2473262706","beacukaimalang"
"1800021903047811393","Mon Jun 10 04:27:37 +0000 2024","0","Selengkapnya klik tautan https://t.co/6NByv2s1mV","1800021980697317424","","beacukaimalang","in","Jl. Surabaya No.2 Malang 65145","0","0","0","https://x.com/beacukaimalang/status/1800021980697317424","2473262706","beacukaimalang"
"1800021903047811393","Mon Jun 10 04:27:19 +0000 2024","1","Bea Cukai Malang melaksanakan monitoring Harga Transaksi Pasar (HTP) untuk Rokok Elektrik (REL) https://t.co/fsPu45eYlH","1800021903047811393","https://pbs.twimg.com/media/GPr2XY6asAAkhZh.jpg","","in","Jl. Surabaya No.2 Malang 65145","0","1","0","https://x.com/beacukaimalang/status/1800021903047811393","2473262706","beacukaimalang"
"1800021254793298372","Mon Jun 10 04:24:44 +0000 2024","1","JASA UNBLOCK IMEI DONE BUAT PAKET 3 BULAN (3 BULAN: 250.000) (KEMENPERIN:780.000) (BEACUKAI:1.100.000) PENGERJAAN SANGAT FATS DAN BERGARANSI ORDER NOW⬇️⬇️ https://t.co/P7iLIrLgrT #zonauang #ZonaBA #Zonajajan #unblockimei #unlockimei #imei #iphone #iphone15 #zonabu #hpinter https://t.co/XIyaducPfU","1800021254793298372","https://pbs.twimg.com/media/GPr1ydFbsAEwKKF.jpg","","in","","0","0","0","https://x.com/UNBLCK_IMEI/status/1800021254793298372","1783188753894551554","UNBLCK_IMEI"
"1799967615923999194","Mon Jun 10 04:08:30 +0000 2024","0","@antonemus Tebak asal negara","1800017169780232586","","antonemus","in","Columbus, IN","0","0","0","https://x.com/beacukaiRl/status/1800017169780232586","120049518","beacukaiRl"
"1800015032601788664","Mon Jun 10 04:00:01 +0000 2024","0","Bea Cukai @beacukaibogor secara aktif berikan asistensi proses ekspor ke CV Kirana Indah serta PT Sinar Artha Karunia ke Jepang Selasa (04/06). UMKM yang bergerak di bidang budidaya tanaman besar ini mengekspor sampel pohon palem senilai Rp550 juta. https://t.co/p9fZStguI8 https://t.co/ykmOhRZrL4","1800015032601788664","https://pbs.twimg.com/media/GPrkRc1asAAax7m.jpg","","in","Indonesia","0","0","0","https://x.com/beacukaiRI/status/1800015032601788664","2940183750","beacukaiRI"
"1799999627279888391","Mon Jun 10 03:30:26 +0000 2024","0","@juneeyeat Halo kakk kebetulan aku lagi open slot unblock imei beacukai keberangktan 27-29 juli dari bandara juanda sby ke kuala lumpur. beacukai pasti permanen yaa boleh tanya tanya dulu kak cek testi di pin buanyakk ","1800007590010909028","","juneeyeat","in","Kota Surabaya, Jawa Timur","0","0","0","https://x.com/cewebucin3/status/1800007590010909028","1386963260440678408","cewebucin3"
"1800007341372588042","Mon Jun 10 03:29:27 +0000 2024","1","morninggg pagii UNBLOCK IMEI (3 BULAN: 250.000) (KEMENPERIN:1.000.000) (BEACUKAI:1.300.000) PENGERJAAN SANGAT FATS DAN BERGARANSI ORDER NOW⬇️⬇️ https://t.co/Wpap4BiGTl #jastipimei #unblockimei #unblokimei #unlockimei #imeibeacukai #beacukai #zonauang #zonajajan https://t.co/TeJWHEi3or","1800007341372588042","https://pbs.twimg.com/media/GPrpI1jboAAriku.jpg","","in","","0","1","0","https://x.com/unlockimeiaman/status/1800007341372588042","1679891000792322051","unlockimeiaman"
"1800006307837247996","Mon Jun 10 03:25:20 +0000 2024","0","walah ternyata modus bule deketin orang lewat virtual tuh bener adanya ya(?) baru nonton di tt TKW Hongkong 36jt hangus gitu aj karena katanya bule Korea ngasih gift dan ibuk 45th ini harus bayar di beacukai sebesar 36jt dr penjelasannya karena bule tsb mencintai dgn tulus","1800006307837247996","","","in","Indonesia","0","0","0","https://x.com/vyeeeeindaeyo/status/1800006307837247996","238535343","vyeeeeindaeyo"
"1800005939594199314","Mon Jun 10 03:23:53 +0000 2024","2","3 BULAN: KEMENPERIN: BEACUKAI: PENGERJAAN SANGAT FATS DAN BERGARANSI #zonauang https://t.co/7gbt3xUfza","1800005939594199314","https://pbs.twimg.com/media/GPrn2wLboAAjKxi.jpg","","in","Kota Serang, Banten","0","0","0","https://x.com/goldenzlock_/status/1800005939594199314","794373990781358080","goldenzlock_"
"1800001050793152690","Mon Jun 10 03:04:27 +0000 2024","1","BNN Provinsi DKI Jakarta &amp; @bckanwiljakarta gelar pemusnahan barang bukti tindak pidana narkotika Kamis (30/05). Berbagai jenis narkotika golongan I dimusnahkan yaitu 3.209 24 gram ganja 236 06 gram sabu &amp; 9 butir ekstasi atau setara 4 4 gram. https://t.co/sYnQcm6sTA https://t.co/30mUN8JKsX","1800001050793152690","https://pbs.twimg.com/media/GPrjaCmbAAAdH8k.jpg","","in","Indonesia","0","1","1","https://x.com/beacukaiRI/status/1800001050793152690","2940183750","beacukaiRI"
"1800001016550789486","Mon Jun 10 03:04:19 +0000 2024","0","Halo Bolo Perak. Sudah tau kan aplikasi kebanggaan BC Perak. SIPINTER atau Sistem Pelayanan dan Informasi Terpadu. Pada aplikasi ini akan diluncurkan menu baru loh yaitu Penerimaan Surat Online . Mau tau lebih lanjut? cek postingan berikut ya. https://t.co/CTtews3WMS","1800001016550789486","https://pbs.twimg.com/media/GPrjYLzbIAAevXa.jpg","","in","Surabaya","0","1","0","https://x.com/bcperak/status/1800001016550789486","60547524","bcperak"
"1799999985058271623","Mon Jun 10 03:00:19 +0000 2024","0","Ikuti media sosial kami ya!!! IG: beacukaimadura Twitter: beacukaimadura Facebook: Bea Cukai Madura Youtube: Bea Cukai Madura SAKERAH BC Madura Sigap Komitmen Responsif dan Bahagia #beacukaimadura #bcmadurawbbm #beacukaimakinbaik","1800000009192301006","","beacukaimadura","in","Pamekasan, Indonesia","0","0","0","https://x.com/beacukaimadura/status/1800000009192301006","1215177881866756096","beacukaimadura"
"1799999985058271623","Mon Jun 10 03:00:18 +0000 2024","0","Terakhir Andru menutup paparannya dengan menyampaikan harapan kepada mahasiswa bahwa apabila mahasiswa nantinya memilih untuk berwirausaha dan berbisnis program Klinik Ekspor ini nantinya dapat dimanfaatkan untuk mengembangkan usahanya.","1800000006956683746","","beacukaimadura","in","Pamekasan, Indonesia","0","1","0","https://x.com/beacukaimadura/status/1800000006956683746","1215177881866756096","beacukaimadura"
"1799999985058271623","Mon Jun 10 03:00:18 +0000 2024","0","Andru berharap dengan adanya sosialisasi ini dapat menumbuhkan semangat dari mahasiswa untuk nantinya bisa melakukan ekspor dan sekaligus menggaungkan stigma bahwa ekspor itu mudah.","1800000004842737792","","beacukaimadura","in","Pamekasan, Indonesia","0","1","0","https://x.com/beacukaimadura/status/1800000004842737792","1215177881866756096","beacukaimadura"
"1799999985058271623","Mon Jun 10 03:00:17 +0000 2024","0","Lebih lanjut para mahasiswa menerima materi tentang Klinik Ekspor dari Bea Cukai Madura serta potensi manfaat dan tata cara untuk memulai ekspor.","1800000002774983070","","beacukaimadura","in","Pamekasan, Indonesia","0","1","0","https://x.com/beacukaimadura/status/1800000002774983070","1215177881866756096","beacukaimadura"
"1799999985058271623","Mon Jun 10 03:00:17 +0000 2024","0","Tentunya diharapkan kegiatan ekspor yang dilakukan nantinya dapat terus berkelanjutan. ungkap Andru dalam paparannya.","1800000000501670143","","beacukaimadura","in","Pamekasan, Indonesia","0","1","0","https://x.com/beacukaimadura/status/1800000000501670143","1215177881866756096","beacukaimadura"
"1799999985058271623","Mon Jun 10 03:00:16 +0000 2024","0"," Ekspor itu mudah. Klinik Ekspor Bea Cukai Madura senantiasa memberikan asistensi dan pendampingan terhadap UMKM agar mampu merambah pasar internasional dengan kegiatan ekspor.","1799999997641195849","","beacukaimadura","in","Pamekasan, Indonesia","0","1","0","https://x.com/beacukaimadura/status/1799999997641195849","1215177881866756096","beacukaimadura"
"1799999985058271623","Mon Jun 10 03:00:15 +0000 2024","0","Dikemas dalam bentuk seminar dalam kegiatan ini narasumber dari Bea Cukai Madura menjelaskan beberapa hal terkait dengan tugas dan fungsi Direktorat Jenderal Bea dan Cukai (DJBC) dukungan pemerintah melalui DJBC dan edukasi klinik ekspor bagi UMKM.","1799999995497853429","","beacukaimadura","in","Pamekasan, Indonesia","0","1","0","https://x.com/beacukaimadura/status/1799999995497853429","1215177881866756096","beacukaimadura"
"1799999985058271623","Mon Jun 10 03:00:15 +0000 2024","0","Hadir sebagai narasumber dalam kegiatan ini Andru Iedwan Permadi (Kepala Seksi Kepatuhan Internal dan Penyuluhan Bea Cukai Madura) dan Suhaydi (CEO PR Empat Sekawan).","1799999993274847381","","beacukaimadura","in","Pamekasan, Indonesia","0","1","0","https://x.com/beacukaimadura/status/1799999993274847381","1215177881866756096","beacukaimadura"
"1799999985058271623","Mon Jun 10 03:00:14 +0000 2024","0","Kegiatan ini diselenggarakan oleh Badan Eksekutif Mahasiswa Fakultas Ilmu Administrasi (BEM FIA) Universitas Madura bekerjasama dengan Bea Cukai Madura dan PR Empat Sekawan.","1799999991118991835","","beacukaimadura","in","Pamekasan, Indonesia","0","1","0","https://x.com/beacukaimadura/status/1799999991118991835","1215177881866756096","beacukaimadura"
"1799999985058271623","Mon Jun 10 03:00:14 +0000 2024","0","Pamekasan (10/06) Bertempat di Gedung Laboratorium Bersama Universitas Madura Bea Cukai Madura berkesempatan untuk menjadi salah satu narasumber pada kegiatan yang bertajuk Bea Cukai Madura x Djava Goes to Campus pada Kamis 6 Juni 2024.","1799999988967309637","","beacukaimadura","in","Pamekasan, Indonesia","0","1","0","https://x.com/beacukaimadura/status/1799999988967309637","1215177881866756096","beacukaimadura"
"1799999985058271623","Mon Jun 10 03:00:13 +0000 2024","0","GAUNGKAN EKSPOR ITU MUDAH KEPADA MAHASISWA https://t.co/uiCBjTfD5n","1799999985058271623","https://pbs.twimg.com/media/GPriHk2bkAAQxbG.jpg","","in","Pamekasan, Indonesia","0","1","0","https://x.com/beacukaimadura/status/1799999985058271623","1215177881866756096","beacukaimadura"
"1799999929512837454","Mon Jun 10 03:00:00 +0000 2024","0","Waspadai Penipuan Mengatasnamakan Bea Cukai! Kenali Modus dan Cara Mengatasinya https://t.co/1xceQnhUKB","1799999929512837454","","","in","","0","0","0","https://x.com/pajakcom/status/1799999929512837454","1340855282407108610","pajakcom"
"1799997620330680481","Mon Jun 10 02:50:49 +0000 2024","0","wts open jastip imei beacukai hp di bawah 500 usd atau sekitar 8.000.000 bebas pajak hanya kena fee jastip (diluar tax jika kena) dom jakarta timur fee jastip 500.000 / hp open 2 slot 18 juni ; eta 21 juni 2024 #buddiesjastip #zonauang #jastipimei","1799997620330680481","","","in","Jakarta Capital Region","0","0","0","https://x.com/buddiestore_ina/status/1799997620330680481","1759840956281749504","buddiestore_ina"
"1799678001543843851","Mon Jun 10 02:44:19 +0000 2024","0","@kura2giok @ardisatriawan Subsidi bang subsidi Lha Indo juga kalo belanja di luar negeri bakal dicegat bea cukai awokwkw","1799995982920487384","","kura2giok","in","","0","0","0","https://x.com/waltuhamogus/status/1799995982920487384","1630922644383211520","waltuhamogus"
"1799993982409461764","Mon Jun 10 02:36:22 +0000 2024","1","READY UNCLOCK IMEI (3 BULAN: 250.000) (KEMENPERIN:750.000) (BEACUKAI:1.050.000) PENGERJAAN SANGAT FATS DAN BERGARANSI ORDER NOW⬇️⬇️ WA CEK DI PROFIL #jastipimei #unblockimei #imeibeacukai #beacukai #zonauang #zonajajan #ZonaBA https://t.co/UDWjnTE6Nf","1799993982409461764","https://pbs.twimg.com/media/GPrc--OawAAFHzg.jpg","","in","Sidoarjo,indonesia","0","0","0","https://x.com/HebelW10648/status/1799993982409461764","1762995359918239744","HebelW10648"
"1799993576207851570","Mon Jun 10 02:34:45 +0000 2024","0","Perkuat Sinergritas Rupbasan Blitar dengan Bea Cukai Blitar Blitar- Pada hari ini Jum at 07 Juni 2024 Rupbasan Blitar Kementerian Hukum dan HAM Jawa Timur kedatangan rekan sejawat Aparat Penegak Hukum (APH) dari Bea Cukai Blitar https://t.co/VX3Y6pyHZm","1799993576207851570","https://pbs.twimg.com/media/GPrcnA_aEAAzMzd.jpg","","in","Blitar, Jawa Timur","0","0","0","https://x.com/RupbasanBlitar/status/1799993576207851570","1270696820008611842","RupbasanBlitar"
"1799985224119726089","Mon Jun 10 02:01:34 +0000 2024","1","Open jasa unlblok IMEI amanah (3 BULAN: 250.000) (KEMENPERIN:750.000) (BEACUKAI:1.050.000) Yang mau order bisa dm atau wa wa cek di profil Proses cepat #zonauang #unblockimei #unlockimei https://t.co/G0KWpTlMhw","1799985224119726089","https://pbs.twimg.com/media/GPrVBJubsAAXpjd.jpg","","in","Sidoarjo, Indonesia","0","0","0","https://x.com/unlockImei23/status/1799985224119726089","4327180394","unlockImei23"
"1799770871026135198","Mon Jun 10 01:54:37 +0000 2024","2","@zoelantic sini kak kalau mau permanen beacukai juga bisa","1799983474377633792","","zoelantic","in","Kuningan, Indonesia","0","0","0","https://x.com/rizkiwiraimei/status/1799983474377633792","1753049884050214912","rizkiwiraimei"
"1799979161228018033","Mon Jun 10 01:37:28 +0000 2024","7","Badan Narkotika Nasional (BNN) Provinsi DKI Jakarta dan Kanwil Bea Cukai Jakarta gelar pemusnahan barang bukti tindak pidana narkotika Kamis 30 Mei 2024. Narkotika yg dimusnahkan beberapa jenis. Hot Mess Pati Robby Purba Fuji Bale Blacklist Polwan Judol Plaza Indonesia https://t.co/US0vAHF6AX","1799979161228018033","https://pbs.twimg.com/media/GPrPgBCbcAAh93O.jpg","","in","","2","1","6","https://x.com/coema_coemi/status/1799979161228018033","1322908062059962369","coema_coemi"
"1799978804011745681","Mon Jun 10 01:36:03 +0000 2024","0","Bea Cukai Madiun mengintensifkan penyisiran atau razia atas rokok tanpa cukai dalam upaya menekan peredaran rokok ilegal di wilayah tugasnya termasuk di Kabupaten Ponorogo Jawa Timur. https://t.co/bAVTHIOitw","1799978804011745681","","","in","Jawa Timur","0","0","0","https://x.com/ANTARAJatim_/status/1799978804011745681","1557190679553769473","ANTARAJatim_"
"1799977495615418545","Mon Jun 10 01:30:51 +0000 2024","0","JASA UNLOCK IMEI 3 BULAN: 250.000 KEMENPERIN:750.000 BEACUKAI:900.000 PAY AFTER GARANSI https://t.co/O3R6bnCr0f #jastipimei #unblockimei #unblokimei #unlockimei #imeibeacukai #beacukai #zonauang #Zonajajan https://t.co/gYGuJE6eTB","1799977495615418545","https://pbs.twimg.com/media/GPrN_iSaAAAJPkX.jpg","","in","Jakarta Barat, DKI Jakarta","0","0","0","https://x.com/raspbelrry/status/1799977495615418545","720193135721058304","raspbelrry"
"1799977161958588883","Mon Jun 10 01:29:32 +0000 2024","5","UNBLOCK IMEI (3 BULAN: 250.000) (KEMENPERIN:750.000) (BEACUKAI:900.000) PENGERJAAN SANGAT FATS DAN BERGARANSI ORDER NOW⬇️⬇️ https://t.co/iWsf2PuYnZ #jastipimei #unblockimei #unblokimei #unlockimei #imeibeacukai #beacukai #zonauang #zonajajan https://t.co/pJEn0hcgxr","1799977161958588883","https://pbs.twimg.com/media/GPrNsDJbsAEwGuu.jpg","","in","Yogyakarta, Indonesia","0","6","5","https://x.com/intanunlockimei/status/1799977161958588883","773469846008762368","intanunlockimei"
"1799977108804108702","Mon Jun 10 01:29:19 +0000 2024","0","UNBLOCK IMEI (3 BULAN: 250.000) (KEMENPERIN:750.000) (BEACUKAI:900.000) PENGERJAAN SANGAT FATS DAN BERGARANSI ORDER NOW⬇️⬇️ https://t.co/uxRQgPR0lr #jastipimei #unblockimei #unblokimei #unlockimei #imeibeacukai #beacukai #zonauang #zonajajan https://t.co/OCUqlBIVvX","1799977108804108702","https://pbs.twimg.com/media/GPrNo42akAALn_N.jpg","","in","Jakarta Barat, DKI Jakarta","0","0","0","https://x.com/dinaunlockimei/status/1799977108804108702","1735609590233153536","dinaunlockimei"
"1799976172765520293","Mon Jun 10 01:25:36 +0000 2024","0","UNBLOCK IMEI (3 BULAN: 250.000) (KEMENPERIN:750.000) (BEACUKAI:900.000) PENGERJAAN SANGAT FATS DAN BERGARANSI ORDER NOW⬇️⬇️ https://t.co/aFYExMQqp7 #jastipimei #unblockimei #unblokimei #unlockimei #imeibeacukai #beacukai #zonauang #Zonajajan https://t.co/hen9sXwZhh","1799976172765520293","https://pbs.twimg.com/media/GPrMyZ3boAEmKDl.jpg","","in","Yogyakarta, Indonesia","0","0","0","https://x.com/Lizeujs/status/1799976172765520293","736815949177868288","Lizeujs"
"1799975562506875068","Mon Jun 10 01:23:10 +0000 2024","0","#wts iphone 11 promax 512gb beacukai resmi handcarry dari sg nota bayar ada. fullset (dus ori adapter kabel kitab2 sim ejector) BH 94% face id truetone on. fungsional lancar semua. harga 8.850K Salemba Jakpus #zonauang #zonajajan #zonabu #wtb #wtt #wtsiphonejkt #wts https://t.co/tRrHO48HLf","1799975562506875068","https://pbs.twimg.com/media/GPrMOg0aUAAmeRR.jpg","","in","","0","0","0","https://x.com/naninuy13/status/1799975562506875068","745255386","naninuy13"
"1799975346240208981","Mon Jun 10 01:22:19 +0000 2024","3","JASA UNLOCK IMEI (3 BULAN: 250.000) (KEMENPERIN:750.000) (BEACUKAI:900.000) PENGERJAAN SANGAT FATS DAN BERGARANSI ORDER NOW https://t.co/iWsf2PuYnZ #jastipimei #unblockimei #unblokimei #unlockimei #imeibeacukai #beacukai #zonauang #Zonajajan https://t.co/71uNTRCYDY","1799975346240208981","https://pbs.twimg.com/media/GPrMCVyb0AAiKaZ.jpg","","in","Yogyakarta, Indonesia","0","0","1","https://x.com/intanunlockimei/status/1799975346240208981","773469846008762368","intanunlockimei"
"1799975306260005214","Mon Jun 10 01:22:09 +0000 2024","0","READY UNCLOCK IMEI (3 BULAN: 250.000) (KEMENPERIN:750.000) (BEACUKAI:1.050.000) PENGERJAAN SANGAT FATS DAN BERGARANSI ORDER NOW⬇️⬇️ https://t.co/fThtVPpQPL #jastipimei #unblockimei #imeibeacukai #beacukai #zonauang #zonajajan #ZonaBA https://t.co/DzGFcNAdqb","1799975306260005214","https://pbs.twimg.com/media/GPrL_9BawAAuI4a.jpg","","in","Bandung, Jawa Barat","0","0","0","https://x.com/imeitrusted12/status/1799975306260005214","1872069044","imeitrusted12"
"1799975209736511548","Mon Jun 10 01:21:46 +0000 2024","0","READY UNCLOCK IMEI (3 BULAN: 250.000) (KEMENPERIN:750.000) (BEACUKAI:1.050.000) PENGERJAAN SANGAT FATS DAN BERGARANSI ORDER NOW⬇️⬇️ https://t.co/5FGRNUMjOc #jastipimei #unblockimei #imeibeacukai #beacukai #zonauang #zonajajan #ZonaBA https://t.co/XSl5rvLR4x","1799975209736511548","https://pbs.twimg.com/media/GPrL6SaacAA6uKw.jpg","","in","unblockimei_amanah","0","0","0","https://x.com/ahsanstoreimeii/status/1799975209736511548","1477287051846316039","ahsanstoreimeii"
"1799975197753389103","Mon Jun 10 01:21:43 +0000 2024","1","JASA UNLOCK IMEI 3 BULAN: 250.000 KEMENPERIN:750.000 BEACUKAI:900.000 PAY AFTER GARANSI https://t.co/O3R6bnCr0f #jastipimei #unblockimei #unblokimei #unlockimei #imeibeacukai #beacukai #zonauang #Zonajajan https://t.co/OcqaM9RmDI","1799975197753389103","https://pbs.twimg.com/media/GPrL5y9aAAE7eOU.jpg","","in","Jakarta Barat, DKI Jakarta","0","0","1","https://x.com/raspbelrry/status/1799975197753389103","720193135721058304","raspbelrry"
"1799975129629458599","Mon Jun 10 01:21:27 +0000 2024","1","JASA UNBLOCK IMEI (3 BULAN: 250.000) (KEMENPERIN:750.000) (BEACUKAI:900.000) PENGERJAAN SANGAT FATS DAN BERGARANSI ORDER NOW⬇️⬇️ https://t.co/uxRQgPR0lr #jastipimei #unblockimei #unblokimei #unlockimei #imeibeacukai #beacukai #zonauang #Zonajajan https://t.co/8Fmw01ZF4P","1799975129629458599","https://pbs.twimg.com/media/GPrL1udbsAAxtD_.jpg","","in","Jakarta Barat, DKI Jakarta","0","0","1","https://x.com/dinaunlockimei/status/1799975129629458599","1735609590233153536","dinaunlockimei"
"1799712024571834546","Mon Jun 10 01:16:44 +0000 2024","0","@medyrenaldy_ kirain bakalan namain dia Bea Cukai","1799973941865574778","","medyrenaldy_","in","Indonesia","0","0","0","https://x.com/ahmad_aaasr/status/1799973941865574778","1478354362510372871","ahmad_aaasr"
"1799973928368267711","Mon Jun 10 01:16:41 +0000 2024","0","Sekelas ck bawa indo kena beacukai ga ya ","1799973928368267711","","","in","Taiwan","0","1","0","https://x.com/yumekojabanii/status/1799973928368267711","1674912344068194305","yumekojabanii"
"1799646632587513896","Mon Jun 10 01:14:09 +0000 2024","0","@BosPurwa Sibuk2 bea cukai tempo hari spertinya jg perintah Lurah... Biasa klu gitu2 lurah ga tampil di depan... APBN udh benar2 sekarat publik meradang trus UKT trus TAPERA... trus apalagi ya...","1799973294009118814","","BosPurwa","in","Indonesia","0","0","1","https://x.com/imanullah/status/1799973294009118814","14492621","imanullah"
"1799964938389311501","Mon Jun 10 00:40:57 +0000 2024","9","Bea Cukai Tegas Menyatakan Kesetaraan Gender di Forum Internasional Mantap Instansi kepabeanan yang memiliki tugas sebagai fasilitator perdagangan ini turut menyuarakan kesetaraan gender melalui forum internasional. ___ Hot Mess Pati Robby Purba Fuji Bale Blacklist Polwan Judol https://t.co/zyJep7by1p","1799964938389311501","https://pbs.twimg.com/media/GPrCkmvaAAEP701.jpg","","in","DKI Jakarta, Indonesia","1","2","9","https://x.com/rasa2086/status/1799964938389311501","1290494259791933443","rasa2086"
"1799961034511483303","Mon Jun 10 00:25:26 +0000 2024","2","READY UNCLOCK IMEI (3 BULAN: 250.000) (KEMENPERIN:750.000) (BEACUKAI:1.050.000) PENGERJAAN SANGAT FATS DAN BERGARANSI ORDER NOW⬇️⬇️ WA CEK DI PROFIL #jastipimei #unblockimei #imeibeacukai #beacukai #zonauang #zonajajan #ZonaBA https://t.co/FN6lb20eSw","1799961034511483303","https://pbs.twimg.com/media/GPq_BESakAEMMRD.jpg","","in","Sidoarjo,indonesia","0","0","1","https://x.com/HebelW10648/status/1799961034511483303","1762995359918239744","HebelW10648"
"1799960769854885995","Mon Jun 10 00:24:23 +0000 2024","1","JASA UNBLOCK IMEI (3 BULAN: 250.000) (KEMENPERIN:750.000) (BEACUKAI:900.000) PENGERJAAN SANGAT FATS DAN BERGARANSI https://t.co/CMmqUYxZQC #jastipimei #unblockimei #unblokimei #unlockimei #imeibeacukai #beacukai #zonauang #Zonajajan https://t.co/n4HOudgxkX","1799960769854885995","https://pbs.twimg.com/media/GPq-x5Ia8AAIFpI.jpg","","in","Bandung, Jawa Barat","0","0","1","https://x.com/xgawin/status/1799960769854885995","2307619736","xgawin"
"1799958528922464533","Mon Jun 10 00:23:25 +0000 2024","0","@Clara_Shinta99 Bea Cukai","1799960526589431970","","Clara_Shinta99","in","","0","0","0","https://x.com/AngingMamiri26/status/1799960526589431970","1749116301921210368","AngingMamiri26"
"1799948204517302674","Mon Jun 10 00:16:18 +0000 2024","1","@colorhejo_ Bea Cukai","1799958734581473548","","colorhejo_","in","Kota Makassar, Sulawesi Selata","0","0","0","https://x.com/NusantaraJaya26/status/1799958734581473548","1750129190937214976","NusantaraJaya26"
"1799958528922464533","Mon Jun 10 00:15:29 +0000 2024","9","Bea Cukai Tegas Menyatakan Kesetaraan Gender Melalui kebijakan responsif gender Bea Cukai berkomitmen untuk mewujudkan kesetaraan agar tercipta keadilan untuk semua pihak. Hot Mess Pati Robby Purba Fuji Bale Blacklist Polwan Judol Plaza Indonesia https://t.co/dp5537aZY6","1799958528922464533","https://pbs.twimg.com/media/GPq8vkaacAAh6yQ.jpg","","in","Indonesian","1","1","9","https://x.com/Clara_Shinta99/status/1799958528922464533","322559270","Clara_Shinta99"
"1799949483431858357","Mon Jun 10 00:13:40 +0000 2024","0","@Saodah1234 Bea Cukai","1799958070640132289","","Saodah1234","in","","0","0","0","https://x.com/AngingMamiri26/status/1799958070640132289","1749116301921210368","AngingMamiri26"
"1799957534641455112","Mon Jun 10 00:11:32 +0000 2024","0","Yess ketipu lagi 2 kali yaAllah sampe udh gabisa nangis sangking tololnya. Kyk udh jelas tf bukan ke rekening malah ke e wallet d lakuin aja. Kek manaa kau nih nancy semacam d hipnotis aja wkwk","1799957534641455112","","","in","Kota Surabaya, Jawa Timur","0","0","0","https://x.com/cewebucin3/status/1799957534641455112","1386963260440678408","cewebucin3"
"1799956400384385347","Mon Jun 10 00:07:02 +0000 2024","9","Bea Cukai terus meningkatkan komitmen dan menerjemahkan kesetaraan Gender dalam setiap kebijakan yang dikeluarkan. Selain itu instansi ini juga berupaya menghilangkan diskriminasi thd perempuan. StraHot Mess Pati Robby Purba Fuji Bale Blacklist Polwan Judol Plaza Indonesia https://t.co/V3V1wPh9LD","1799956400384385347","https://pbs.twimg.com/media/GPq6zXbaMAAeyZ5.jpg","","in","Bandung, Indonesia","1","1","9","https://x.com/septixtang/status/1799956400384385347","1334156528174022659","septixtang"
"1799955220832887013","Mon Jun 10 00:02:20 +0000 2024","0","Alhamdulillah terima kasih yah kk udah mau order di jasa kami ORDER NOW⬇️⬇️ https://t.co/idMfiJDbeK (3 BULAN: 250.000) (KEMENPERIN:750.000) (BEACUKAI:1.050.000) #jastipimei #unblockimei #unblokimei #imeibeacukai #beacukai #zonauang #zonajajan #ZonaBA https://t.co/m4QRfzhDT2","1799955220832887013","https://pbs.twimg.com/media/GPq5vBjasAA4rw2.jpg","","in","Jambi, Indonesia","0","0","0","https://x.com/unblockimeitika/status/1799955220832887013","3068169540","unblockimeitika"
